{
  "kind": "heimgeist.self_state.snapshot",
  "version": 1,
  "id": "123e4567-e89b-12d3-a456-426614174000",
  "meta": {
    "occurred_at": "2026-01-11T20:00:00Z"
  },
  "data": {
    "confidence": 0.9,
    "fatigue": 0.1,
    "risk_tension": 0.2,
    "autonomy_level": "aware",
    "last_updated": "2026-01-11T20:00:00Z",
    "basis_signals": [
      "ALL_GREEN"
    ]
  }
}
